{
  "type": "sessionState",
  "version": 0,
  "sessionId": "Qm9yZWFsaXNQcmlvcml0eQ",
  "name": "Atelier T4",
  "status": "PREPARATION",
  "method": "WSJF",
  "methodVersion": 1,
  "methodDefinition": {
    "key": "WSJF",
    "version": 1,
    "name": "WSJF",
    "criteria": [
      {
        "key": "bv",
        "code": "BV",
        "label": "Business Value",
        "definition": "Valeur apportée aux utilisateurs ou à l'entreprise : plus elle est élevée, plus la fonctionnalité compte.",
        "header": "BV"
      },
      {
        "key": "tc",
        "code": "TC",
        "label": "Time Criticality",
        "definition": "Urgence : la valeur diminue avec le temps ou une échéance approche.",
        "header": "TC"
      },
      {
        "key": "rrOe",
        "code": "RR/OE",
        "label": "Risk Reduction / Opportunity Enablement",
        "definition": "Risque réduit ou opportunité ouverte par la fonctionnalité.",
        "header": "RR/OE"
      },
      {
        "key": "js",
        "code": "JS",
        "label": "Job Size",
        "definition": "Taille du travail : plus elle est élevée, plus le score baisse.",
        "header": "JS"
      }
    ],
    "computedValues": [
      {
        "key": "cod",
        "code": "CoD",
        "label": "Cost of Delay",
        "definition": "Coût du retard : BV + TC + RR/OE.",
        "header": "CoD",
        "display": "INTEGER"
      },
      {
        "key": "wsjf",
        "code": "WSJF",
        "label": "Weighted Shortest Job First",
        "definition": "Priorité : CoD divisé par JS. Plus il est élevé, plus la fonctionnalité passe tôt.",
        "header": "WSJF",
        "display": "DECIMAL_2"
      }
    ],
    "formula": "CoD = BV + TC + RR/OE ; WSJF = CoD / JS",
    "tieBreakRule": "WSJF décroissant, puis CoD décroissant, puis identifiant croissant sans tenir compte de la casse. Les fonctionnalités incomplètes ou hors échelle viennent ensuite, par identifiant croissant."
  },
  "formula": "CoD = BV + TC + RR/OE ; WSJF = CoD / JS",
  "tieBreakRule": "WSJF décroissant, puis CoD décroissant, puis identifiant croissant sans tenir compte de la casse. Les fonctionnalités incomplètes ou hors échelle viennent ensuite, par identifiant croissant.",
  "scale": {
    "type": "CONTINUOUS",
    "max": 10,
    "allowedValues": [1, 2, 3, 4, 5, 6, 7, 8, 9, 10]
  },
  "participants": [
    {
      "participantId": "a1b2c3d4-0001-4000-8000-000000000001",
      "pseudo": "anim",
      "role": "FACILITATOR",
      "businessRole": "Product Owner",
      "online": true
    }
  ],
  "features": [],
  "me": {
    "participantId": "a1b2c3d4-0001-4000-8000-000000000001",
    "pseudo": "anim",
    "role": "FACILITATOR"
  }
}
